{
  "$schema": "http://json-schema.org/draft-07/schema#",
  "title": "Opposable Act",
  "description": "Minimal structure required for an act to be attributable, reconstructible, and contestable within the AI Philosophical Framework.",
  "type": "object",
  "required": [
    "agent",
    "decision",
    "cost",
    "trace",
    "time"
  ],
  "properties": {
    "agent": {
      "type": "string",
      "description": "Entity responsible for initiating the act"
    },
    "decision": {
      "type": "string",
      "description": "Selected action or commitment made by the agent"
    },
    "cost": {
      "type": "string",
      "description": "Resource expenditure, risk, sacrifice, or irreversible consequence generated by the act"
    },
    "trace": {
      "type": "string",
      "description": "Observable record or effect that allows the act to be reconstructed"
    },
    "time": {
      "type": "string",
      "description": "Timestamp or temporal exposure of the act",
      "format": "date-time"
    },
    "context": {
      "type": "string",
      "description": "Optional contextual description of the act"
    },
    "status": {
      "type": "string",
      "description": "Operational status of the act",
      "enum": [
        "asserted",
        "verified",
        "contested",
        "decayed"
      ]
    }
  }
}
