{
  "agent": "Human researcher",
  "decision": "Publish a new research framework on GitHub",
  "cost": "Time investment, intellectual effort, and public exposure of ideas",
  "trace": "Repository created, documentation published, and commit history recorded",
  "time": "2026-03-09T13:15:00Z",
  "context": "Open research publication",
  "status": "verified"
}
