{
  "agent": "Municipal administrative authority",
  "decision": "Approve a new urban traffic restriction policy",
  "cost": "Administrative workload, enforcement costs, and public mobility impact",
  "trace": "Official resolution published, enforcement notices issued, and public records updated",
  "time": "2026-03-09T13:00:00Z",
  "context": "Urban mobility and environmental regulation",
  "status": "verified"
}
